[
  {
    "address": "Av. Central, 456",
    "territory": "Zona Sul",
    "status": "pregado",
    "contact_name": "Maria Oliveira",
    "phone": "+55 21 98888-7777",
    "observations": "Apartamento 202",
    "best_time": "Domingo de manh√£",
    "last_visit_date": "2025-09-15",
    "visit_count": 5,
    "assigned_to_email": "maria@example.com"
  }
]